{
  "capabilityVersion": "0.1.0",
  "contract": {
    "goal": "Create a LedgerSMB company and its first administrator, then prove the account can authenticate.",
    "inputs": {
      "baseUrl": "string",
      "company": "string",
      "databaseAdmin": "string",
      "databasePassword": "string",
      "password": "string",
      "username": "string"
    },
    "outputs": {},
    "successCondition": "The new administrator reaches the LedgerSMB home screen."
  },
  "entryStageId": "open-setup",
  "id": "ledgersmb.initialize-company",
  "policy": {
    "allowedActionTypes": [
      "navigate",
      "activate",
      "fill"
    ],
    "allowedOrigins": [
      "http://127.0.0.1:5762"
    ],
    "riskyActionMode": "block"
  },
  "provenance": {
    "createdAt": "2026-09-15T16:24:57.450Z",
    "discoveryRunId": "20260915162457450-f9c72fa6",
    "validatedRunIds": [
      "20260929120812777-6d5315d1"
    ]
  },
  "schemaVersion": "1",
  "stages": [
    {
      "action": {
        "type": "navigate",
        "url": "{{input.baseUrl}}/setup.pl"
      },
      "description": "Open the setup console.",
      "detectors": [
        {
          "description": "Expected state after open-setup",
          "id": "open-setup-complete",
          "scope": "capability",
          "signals": [
            {
              "kind": "role",
              "name": "Create",
              "role": "button"
            }
          ]
        }
      ],
      "extractions": [],
      "id": "open-setup",
      "otherwise": {
        "outcome": {
          "code": "unexpected-screen",
          "type": "failure"
        },
        "type": "terminal"
      },
      "risk": "reversible",
      "transitions": [
        {
          "destination": {
            "stageId": "fill-db-admin",
            "type": "stage"
          },
          "detectorId": "open-setup-complete"
        }
      ]
    },
    {
      "action": {
        "target": {
          "candidates": [
            {
              "kind": "css",
              "selector": "#s-user"
            }
          ],
          "require": "exactly-one"
        },
        "type": "fill",
        "value": "{{input.databaseAdmin}}"
      },
      "description": "Enter the database administrator.",
      "detectors": [
        {
          "description": "Expected state after fill-db-admin",
          "id": "fill-db-admin-complete",
          "scope": "capability",
          "signals": [
            {
              "kind": "role",
              "name": "Create",
              "role": "button"
            }
          ]
        }
      ],
      "extractions": [],
      "id": "fill-db-admin",
      "otherwise": {
        "outcome": {
          "code": "unexpected-screen",
          "type": "failure"
        },
        "type": "terminal"
      },
      "risk": "reversible",
      "transitions": [
        {
          "destination": {
            "stageId": "fill-db-password",
            "type": "stage"
          },
          "detectorId": "fill-db-admin-complete"
        }
      ]
    },
    {
      "action": {
        "target": {
          "candidates": [
            {
              "kind": "css",
              "selector": "#s-password"
            }
          ],
          "require": "exactly-one"
        },
        "type": "fill",
        "value": "{{input.databasePassword}}"
      },
      "description": "Enter the database password.",
      "detectors": [
        {
          "description": "Expected state after fill-db-password",
          "id": "fill-db-password-complete",
          "scope": "capability",
          "signals": [
            {
              "kind": "role",
              "name": "Create",
              "role": "button"
            }
          ]
        }
      ],
      "extractions": [],
      "id": "fill-db-password",
      "otherwise": {
        "outcome": {
          "code": "unexpected-screen",
          "type": "failure"
        },
        "type": "terminal"
      },
      "risk": "reversible",
      "transitions": [
        {
          "destination": {
            "stageId": "fill-company",
            "type": "stage"
          },
          "detectorId": "fill-db-password-complete"
        }
      ]
    },
    {
      "action": {
        "target": {
          "candidates": [
            {
              "kind": "css",
              "selector": "#database"
            }
          ],
          "require": "exactly-one"
        },
        "type": "fill",
        "value": "{{input.company}}"
      },
      "description": "Enter the company database name.",
      "detectors": [
        {
          "description": "Expected state after fill-company",
          "id": "fill-company-complete",
          "scope": "capability",
          "signals": [
            {
              "kind": "role",
              "name": "Create",
              "role": "button"
            }
          ]
        }
      ],
      "extractions": [],
      "id": "fill-company",
      "otherwise": {
        "outcome": {
          "code": "unexpected-screen",
          "type": "failure"
        },
        "type": "terminal"
      },
      "risk": "reversible",
      "transitions": [
        {
          "destination": {
            "stageId": "create-company",
            "type": "stage"
          },
          "detectorId": "fill-company-complete"
        }
      ]
    },
    {
      "action": {
        "target": {
          "candidates": [
            {
              "kind": "role",
              "name": "Create",
              "role": "button"
            }
          ],
          "require": "exactly-one"
        },
        "type": "activate"
      },
      "description": "Create the company database.",
      "detectors": [
        {
          "description": "Expected state after create-company",
          "id": "create-company-complete",
          "scope": "capability",
          "signals": [
            {
              "kind": "role",
              "name": "Argentina",
              "role": "option"
            }
          ]
        }
      ],
      "extractions": [],
      "id": "create-company",
      "otherwise": {
        "outcome": {
          "code": "unexpected-screen",
          "type": "failure"
        },
        "type": "terminal"
      },
      "risk": "reversible",
      "transitions": [
        {
          "destination": {
            "stageId": "open-country-list",
            "type": "stage"
          },
          "detectorId": "create-company-complete"
        }
      ]
    },
    {
      "action": {
        "target": {
          "candidates": [
            {
              "kind": "role",
              "name": "Argentina",
              "role": "option"
            }
          ],
          "require": "exactly-one"
        },
        "type": "activate"
      },
      "description": "Open the chart country list.",
      "detectors": [
        {
          "description": "Expected state after open-country-list",
          "id": "open-country-list-complete",
          "scope": "capability",
          "signals": [
            {
              "kind": "role",
              "name": "United States",
              "role": "option"
            }
          ]
        }
      ],
      "extractions": [],
      "id": "open-country-list",
      "otherwise": {
        "outcome": {
          "code": "unexpected-screen",
          "type": "failure"
        },
        "type": "terminal"
      },
      "risk": "reversible",
      "transitions": [
        {
          "destination": {
            "stageId": "choose-chart-country",
            "type": "stage"
          },
          "detectorId": "open-country-list-complete"
        }
      ]
    },
    {
      "action": {
        "target": {
          "candidates": [
            {
              "kind": "role",
              "name": "United States",
              "role": "option"
            }
          ],
          "require": "exactly-one"
        },
        "type": "activate"
      },
      "description": "Choose the United States chart family.",
      "detectors": [
        {
          "description": "Expected state after choose-chart-country",
          "id": "choose-chart-country-complete",
          "scope": "capability",
          "signals": [
            {
              "kind": "role",
              "name": "Next",
              "role": "button"
            }
          ]
        }
      ],
      "extractions": [],
      "id": "choose-chart-country",
      "otherwise": {
        "outcome": {
          "code": "unexpected-screen",
          "type": "failure"
        },
        "type": "terminal"
      },
      "risk": "reversible",
      "transitions": [
        {
          "destination": {
            "stageId": "confirm-chart-country",
            "type": "stage"
          },
          "detectorId": "choose-chart-country-complete"
        }
      ]
    },
    {
      "action": {
        "target": {
          "candidates": [
            {
              "kind": "role",
              "name": "Next",
              "role": "button"
            }
          ],
          "require": "exactly-one"
        },
        "type": "activate"
      },
      "description": "Continue from the chart country selection.",
      "detectors": [
        {
          "description": "Expected state after confirm-chart-country",
          "id": "confirm-chart-country-complete",
          "scope": "capability",
          "signals": [
            {
              "exact": false,
              "kind": "text",
              "value": "The selected country ('us') has"
            }
          ]
        }
      ],
      "extractions": [],
      "id": "confirm-chart-country",
      "otherwise": {
        "outcome": {
          "code": "unexpected-screen",
          "type": "failure"
        },
        "type": "terminal"
      },
      "risk": "reversible",
      "transitions": [
        {
          "destination": {
            "stageId": "confirm-chart",
            "type": "stage"
          },